{
  "kind": "tree",
  "schema_version": 1,
  "sha256": "7d046a1332b36918ab05b5e78be58066afc02ca97f5f0e29930a29beb62d03b9",
  "size_bytes": 6329024,
  "extractor": {
    "name": "pspdb-ingest",
    "version": "6",
    "options": []
  },
  "entries": [
    {
      "path": "PARAM.SFO",
      "type": "file",
      "size_bytes": 408,
      "sha256": "99a1f43b0c602b143f7e50c58a5ef0402c15cd43d6bd2b6ee9353421deb567b8"
    },
    {
      "path": "PS3LOGO.DAT",
      "type": "file",
      "size_bytes": 5120,
      "sha256": "e08430957ac3f4ee719dc2ed04d3443c395dd3b997d8f34f68a1b5c37d92f425"
    },
    {
      "path": "USRDIR",
      "type": "directory"
    },
    {
      "path": "USRDIR/CONTENT",
      "type": "directory"
    },
    {
      "path": "USRDIR/CONTENT/PBOOT.PBP",
      "type": "file",
      "size_bytes": 6187435,
      "sha256": "b1cea915e626ae9f44527e010ea88e8cf8c66ac010b74312a719a11f5b8b614c"
    },
    {
      "path": "USRDIR/CONTENT/evept105.EDAT",
      "type": "file",
      "size_bytes": 133600,
      "sha256": "704f390e4572ec4aef5f006bbc0f07ae0ed605a34d285166f608cd9b2103a1ce"
    },
    {
      "path": "USRDIR/ISO.BIN.EDAT",
      "type": "file",
      "size_bytes": 272,
      "sha256": "b36ca890bdfeb465c658ea793cd9a156b01378036efe500a66c7adf9afa6e3e2"
    }
  ]
}
