{
  "kind": "tree",
  "schema_version": 1,
  "sha256": "43fc4617035dd7a90718eda5dfc11017e91b6985c01d7a7eba21724724c320bf",
  "size_bytes": 981248,
  "extractor": {
    "name": "pspdb-ingest",
    "version": "12",
    "options": []
  },
  "name_rule": "source_stem",
  "entries": [
    {
      "path": "module.elf",
      "type": "file",
      "size_bytes": 980912,
      "sha256": "822ccbcc39c8ae4e03d81df264fa1a6febdd21f51d7e4c740c4db49ad1b90cc5"
    }
  ]
}
