{
  "kind": "tree",
  "schema_version": 1,
  "sha256": "718cbb74bdd26276281c111f05a7ba0cda508a86a732d4f3cd2219e95aa5caa6",
  "size_bytes": 6017120,
  "extractor": {
    "name": "pspdb-ingest",
    "version": "2",
    "options": []
  },
  "entries": [
    {
      "path": "disc.iso",
      "type": "file",
      "size_bytes": 119504896,
      "sha256": "26f9dd783913f2990f84cfb1cd1f703ed94e485262755e7602c7314bbd469781"
    }
  ]
}
