{
  "kind": "tree",
  "schema_version": 1,
  "sha256": "1345f506b8cd622ade95e2dc504fc80ce7aec52113fea25db32a26358f4dfe71",
  "size_bytes": 7185952,
  "extractor": {
    "name": "pspdb-ingest",
    "version": "11",
    "options": []
  },
  "name_rule": "source_stem",
  "entries": [
    {
      "path": "module.elf",
      "type": "file",
      "size_bytes": 7185613,
      "sha256": "dc054e320ea2e9d9438007856736b03a56adde6060e8336c945a9efaabac17e9"
    }
  ]
}
