{
  "kind": "tree",
  "schema_version": 1,
  "sha256": "0278aaa748932938b4cdbdd6fd47f14146497c1618e235ec6a7ae4e22ed5d79f",
  "size_bytes": 271809,
  "extractor": {
    "name": "pspdb-ingest",
    "version": "4",
    "options": []
  },
  "name_rule": "decoded_suffix",
  "entries": [
    {
      "path": "payload.bin",
      "type": "file",
      "size_bytes": 558736,
      "sha256": "2659644d2a3585ba288abd898552c80e8d0eacd1195127248ceefea4a42bec81"
    }
  ]
}
