{
  "kind": "tree",
  "schema_version": 1,
  "sha256": "2b0caac536ffcafad8703a683f39c5e9f3c11b6555e7f028f00b28a7ca8647a6",
  "size_bytes": 5896720,
  "extractor": {
    "name": "pspdecrypt",
    "sha256": "ad169bba068d608781089f4899cb1cbf02213cccfff94bfa41909c63282da585",
    "version": "3",
    "options": [
      "-o",
      "<output>",
      "<source>"
    ]
  },
  "name_rule": "source_stem",
  "entries": [
    {
      "path": "module.elf",
      "type": "file",
      "size_bytes": 5894312,
      "sha256": "ff9b52f165772fd52268152069f6c966dcc558847f6eed2ba6d0597b7d0e664f"
    }
  ]
}
