{
  "kind": "tree",
  "schema_version": 1,
  "sha256": "861c0f10872faef964b5a177edf8e2acab4d783ad924de6a95a5217e84dab72b",
  "size_bytes": 29701312,
  "extractor": {
    "name": "Zig-PSP zPBPTool",
    "version": "4",
    "options": [
      "in-memory"
    ]
  },
  "entries": [
    {
      "path": "DATA.BIN",
      "type": "file",
      "size_bytes": 29244352,
      "sha256": "d232b0dc1da81d669f36729fbae20f3cfc983b78684017a66ce49d84d5725d40"
    },
    {
      "path": "DATA.PSP",
      "type": "file",
      "size_bytes": 15231,
      "sha256": "6aeb1f5446a36c72158903a27a4941009af11c019004aad9648af51a4a85cde0"
    },
    {
      "path": "ICON0.PNG",
      "type": "file",
      "size_bytes": 14451,
      "sha256": "68450687318b724c8ef63b8f307d4fe7c45fd1800edad753f9350d84d5a3fe02"
    },
    {
      "path": "PARAM.SFO",
      "type": "file",
      "size_bytes": 592,
      "sha256": "4f2ffc97d7160c3e55af5722a638bf8aa6892b8af067f60fb8a968ca99f494e7"
    },
    {
      "path": "PIC0.PNG",
      "type": "file",
      "size_bytes": 97495,
      "sha256": "233af0e5c22e5db961a49f567bbe696b10dd5459e30e5ac05af6411424815c97"
    },
    {
      "path": "PIC1.PNG",
      "type": "file",
      "size_bytes": 190599,
      "sha256": "6fd60c900e130540e2dc978b430080d1dcd9f8a1952ae08f815959c0865e30f8"
    },
    {
      "path": "SND0.AT3",
      "type": "file",
      "size_bytes": 138552,
      "sha256": "310290878c8969702d05274b52474c7b2343787e7b286cd0062660852840613f"
    },
    {
      "path": "STARTDAT",
      "type": "file",
      "size_bytes": 13791,
      "sha256": "5b4f45717ac245b6ca7478ed6d21237dc14442b77c35abba8b24fab553fa41b6"
    }
  ]
}
