{
  "kind": "tree",
  "schema_version": 1,
  "sha256": "a7e797a81737ab440e8e1a2af4110bca31baacededb6b3b1ee652d0662c4f576",
  "size_bytes": 51872,
  "extractor": {
    "name": "pspdb-ingest",
    "version": "4",
    "options": []
  },
  "name_rule": "decoded_suffix",
  "entries": [
    {
      "path": "payload.bin",
      "type": "file",
      "size_bytes": 262348,
      "sha256": "a4710cf0d11055b6c39d6c6ce69c06539020e5022b39a89396a519c9eeb8d25c"
    }
  ]
}
