{
  "kind": "tree",
  "schema_version": 1,
  "sha256": "179e220f4b21006cf13976ab4a7404800bfdd6db44d5d34992bcd0cc7ab31e71",
  "size_bytes": 4359008,
  "extractor": {
    "name": "pspdecrypt",
    "sha256": "5511936205cdb38f05165964c34b12be8797075644537ed0c4d74ad865d71a2d",
    "version": "1",
    "options": [
      "-o",
      "<output>",
      "<source>"
    ]
  },
  "name_rule": "source_stem",
  "entries": [
    {
      "path": "module.prx",
      "type": "file",
      "size_bytes": 4358672,
      "sha256": "348e3e879136866ef6f5a0a1ccd26d8fb52c8cb3230bd8374a1d4d755dd41913"
    }
  ]
}
