{
  "kind": "tree",
  "schema_version": 1,
  "sha256": "61daa3db1d5e70bf14fa3ac0b01b7f5a43e8e3769b23e07ed887995924af8a62",
  "size_bytes": 184451072,
  "extractor": {
    "name": "pspdb-ingest",
    "version": "4",
    "options": []
  },
  "entries": [
    {
      "path": "PSP_GAME",
      "type": "directory"
    },
    {
      "path": "PSP_GAME/ICON0.PNG",
      "type": "file",
      "size_bytes": 16046,
      "sha256": "6c69b8726389d89333566086bf07ba0023c2319ca60f4dd24e14ea604919b97f"
    },
    {
      "path": "PSP_GAME/PARAM.SFO",
      "type": "file",
      "size_bytes": 604,
      "sha256": "8b1976be35752241218f3c788e4e7fdec1a6b467d0f639c0067e701714fb9a4c"
    },
    {
      "path": "PSP_GAME/PIC1.PNG",
      "type": "file",
      "size_bytes": 167178,
      "sha256": "a37ac1ce4bffe78a9ab4d199da2b73db8330fe880f76a9635e8035f8809d4c42"
    },
    {
      "path": "PSP_GAME/SYSDIR",
      "type": "directory"
    },
    {
      "path": "PSP_GAME/SYSDIR/BOOT.BIN",
      "type": "file",
      "size_bytes": 3383069,
      "sha256": "d336f060e5d89fd7df1b2cb1ec38914c37be364a626eea72896f9653097703d5"
    },
    {
      "path": "PSP_GAME/SYSDIR/EBOOT.BIN",
      "type": "file",
      "size_bytes": 3383408,
      "sha256": "7d5b2f7ef9d70a6f681405d5ce1f4eb45b55ba6a8b71b3adef908e6b004918c4"
    },
    {
      "path": "PSP_GAME/SYSDIR/OPNSSMP.BIN",
      "type": "file",
      "size_bytes": 1048576,
      "sha256": "30e14955ebf1352266dc2ff8067e68104607e750abb9d3b36582b8af909fcb58"
    },
    {
      "path": "PSP_GAME/SYSDIR/UPDATE",
      "type": "directory"
    },
    {
      "path": "PSP_GAME/SYSDIR/UPDATE/DATA.BIN",
      "type": "file",
      "size_bytes": 99614720,
      "sha256": "907246287dc7f85bb214dcfe0c728fb3cd24ca6f9b193c96c6f7668433be91f5"
    },
    {
      "path": "PSP_GAME/SYSDIR/UPDATE/EBOOT.BIN",
      "type": "file",
      "size_bytes": 8388608,
      "sha256": "2daeb1f36095b44b318410b3f4e8b5d989dcc7bb023d1426c492dab0a3053e74"
    },
    {
      "path": "PSP_GAME/SYSDIR/UPDATE/PARAM.SFO",
      "type": "file",
      "size_bytes": 0,
      "sha256": "e3b0c44298fc1c149afbf4c8996fb92427ae41e4649b934ca495991b7852b855"
    },
    {
      "path": "PSP_GAME/USRDIR",
      "type": "directory"
    },
    {
      "path": "PSP_GAME/USRDIR/bgm",
      "type": "directory"
    },
    {
      "path": "PSP_GAME/USRDIR/bgm/bgm01.at3",
      "type": "file",
      "size_bytes": 959112,
      "sha256": "eea4a0619066e6958bde1352dacdda10280f3ba552ee30b61131fa3ee236274a"
    },
    {
      "path": "PSP_GAME/USRDIR/bgm/bgm05.at3",
      "type": "file",
      "size_bytes": 962900,
      "sha256": "79f8c7feacbf85fc05df2c6cb3aa09dd5f643df0b7fae423aba00256020f3bca"
    },
    {
      "path": "PSP_GAME/USRDIR/bgm/bgm06.at3",
      "type": "file",
      "size_bytes": 1000844,
      "sha256": "3b6019235afb7e4b1513b15b71d36f2cb4e79970ea475e9a6b9430ffcdde6b79"
    },
    {
      "path": "PSP_GAME/USRDIR/bgm/bgm07.at3",
      "type": "file",
      "size_bytes": 1223300,
      "sha256": "cb066561309dbac32a6decc941c36e75ab327f53249750538dad8ded4705c5c1"
    },
    {
      "path": "PSP_GAME/USRDIR/bgm/bgm08.at3",
      "type": "file",
      "size_bytes": 866180,
      "sha256": "6b4464e06e71081469f7e00dd6cd085c30388e53ce18279c49a2ca809dd58fc4"
    },
    {
      "path": "PSP_GAME/USRDIR/bgm/bgm12.at3",
      "type": "file",
      "size_bytes": 587180,
      "sha256": "bfe73abe0975106c9e6b545001497ed11e97ec438cd57516a2f11ea057d18dea"
    },
    {
      "path": "PSP_GAME/USRDIR/bgm/bgm13.at3",
      "type": "file",
      "size_bytes": 1014236,
      "sha256": "c609715f75edb9a0903600280a52749a50c791b2783fd538bb2ff8f887257546"
    },
    {
      "path": "PSP_GAME/USRDIR/bgm/bgm14.at3",
      "type": "file",
      "size_bytes": 1389212,
      "sha256": "e53225353efb3caaa1c74d91b7aa7ea68a8867e3e22f16c5827eee4d85f0372d"
    },
    {
      "path": "PSP_GAME/USRDIR/bgm/bgm15.at3",
      "type": "file",
      "size_bytes": 1328204,
      "sha256": "e1de3f5ccfcbfbc289204b96fa8e5ab50892c2cb66efb0a4b1abc5c389b2c039"
    },
    {
      "path": "PSP_GAME/USRDIR/bgm/bgm16.at3",
      "type": "file",
      "size_bytes": 1413020,
      "sha256": "e4fd69d070ed62ed32f24868a327c166add5748085abcf36de8b49633870e117"
    },
    {
      "path": "PSP_GAME/USRDIR/bgm/bgm21.at3",
      "type": "file",
      "size_bytes": 1536524,
      "sha256": "52e94725555493d1d2f05a2f426cef559c47bd6bbe1b1761ac14aff80738dd56"
    },
    {
      "path": "PSP_GAME/USRDIR/bgm/bgm31.at3",
      "type": "file",
      "size_bytes": 1369868,
      "sha256": "3ccceaf874540c262b8604ed25df1cf991ad814b468186963e60e4c5b219b3da"
    },
    {
      "path": "PSP_GAME/USRDIR/bgm/bgm39.at3",
      "type": "file",
      "size_bytes": 1407812,
      "sha256": "e41dc5d89c06605f763c8f38c946d1dcd69a1433326a1cb3f28d114d12bd34aa"
    },
    {
      "path": "PSP_GAME/USRDIR/bgm/bgm43.at3",
      "type": "file",
      "size_bytes": 930164,
      "sha256": "ce1fbd4413317e30c4b602bc7d3943632190164bd4d110d704340eb8b737defd"
    },
    {
      "path": "PSP_GAME/USRDIR/bgm/bgm45.at3",
      "type": "file",
      "size_bytes": 1064084,
      "sha256": "82a8f24b9e49e463517e73d9f46185c4fd379492a5fa0e442d7d8a48a12a6638"
    },
    {
      "path": "PSP_GAME/USRDIR/bgm/bgm46.at3",
      "type": "file",
      "size_bytes": 689108,
      "sha256": "e072d145a9957bdff98db9fedf4b8df7f2e1e83a0da504b50cbba5425569c56d"
    },
    {
      "path": "PSP_GAME/USRDIR/bgm/bgm47.at3",
      "type": "file",
      "size_bytes": 878084,
      "sha256": "8dd6a907aa2c80abf544bac6f92083393f7c0a4319af35bce9466eca8aade27f"
    },
    {
      "path": "PSP_GAME/USRDIR/bgm/bgm48.at3",
      "type": "file",
      "size_bytes": 1243388,
      "sha256": "91b5bc72cfa020928261391eef918c7076773cb3190cf5e6d9b7f88f3dfc3445"
    },
    {
      "path": "PSP_GAME/USRDIR/bgm/bgm49.at3",
      "type": "file",
      "size_bytes": 1126580,
      "sha256": "38d17c0a34e37878e3f5d979a13d36d6a247ed8a841a52eee8f0bddafdd8c0bf"
    },
    {
      "path": "PSP_GAME/USRDIR/bgm/bgm52.at3",
      "type": "file",
      "size_bytes": 917516,
      "sha256": "ddd018c0098c20f6e3bc9508bc8c986006fa55de529347154cbf7e0653f2cf41"
    },
    {
      "path": "PSP_GAME/USRDIR/bgm/bgm55.at3",
      "type": "file",
      "size_bytes": 1034324,
      "sha256": "0407f5e6adc9775e4825e81ee5a4522bce736f282bc2b95667999ae253cdb48c"
    },
    {
      "path": "PSP_GAME/USRDIR/bgm/bgm58.at3",
      "type": "file",
      "size_bytes": 1058132,
      "sha256": "7f873d1bd5a6c6d8960620c37be5868a91e41d20297960065615c9d1242bd9ad"
    },
    {
      "path": "PSP_GAME/USRDIR/bgm/bgm59.at3",
      "type": "file",
      "size_bytes": 881060,
      "sha256": "b35ce6734c9e4c8e056cf62d732e42af99c39d88398a75500e96b537591be5a6"
    },
    {
      "path": "PSP_GAME/USRDIR/bgm/bgm63.at3",
      "type": "file",
      "size_bytes": 938348,
      "sha256": "c86cb35e4097036e6b92d785d8198bd3307b747f58cc2f8393955b9a8834e7d8"
    },
    {
      "path": "PSP_GAME/USRDIR/bgm/bgm70.at3",
      "type": "file",
      "size_bytes": 693572,
      "sha256": "f64774b5a52fb5bca38e62cdc260e3c51d25ca53e61a4e05cfb8dceac1830cd0"
    },
    {
      "path": "PSP_GAME/USRDIR/bgm/bgm71.at3",
      "type": "file",
      "size_bytes": 288836,
      "sha256": "937e007e354dd06ec84c4d86bbfc0c2fa0127a822264569f3a2636dbe7d1bea9"
    },
    {
      "path": "PSP_GAME/USRDIR/bgm/bgm72.at3",
      "type": "file",
      "size_bytes": 532868,
      "sha256": "f037d614d3d1a8064a2ce8222875d4827436ac2bb735cabaf2d720561b9c9b5c"
    },
    {
      "path": "PSP_GAME/USRDIR/bgm/bgm73.at3",
      "type": "file",
      "size_bytes": 462932,
      "sha256": "ec5570cbdde69369600fdacfbd114864a382a4b50be0295333cfa8d86321e2c6"
    },
    {
      "path": "PSP_GAME/USRDIR/bgm/bgm74.at3",
      "type": "file",
      "size_bytes": 504528,
      "sha256": "e6593916819d060b4b0c9dd465edf4bef1154ef2cb1ce77b6ec67c5c7a52bac1"
    },
    {
      "path": "PSP_GAME/USRDIR/bgm/bgm75.at3",
      "type": "file",
      "size_bytes": 376628,
      "sha256": "d69a94913aaa37aa4ad9679215821e15d63f8cfd04ef68e6ed70495af416008f"
    },
    {
      "path": "PSP_GAME/USRDIR/data.dar",
      "type": "file",
      "size_bytes": 26122608,
      "sha256": "08ca88d64d58a8dbb6b72f4113fede623cb6a14a5462702db3769fe6e3124723"
    },
    {
      "path": "PSP_GAME/USRDIR/ini.dar",
      "type": "file",
      "size_bytes": 3470640,
      "sha256": "972aa6ea1839a6f3dd6e2088b409d43b8df1bdadbbdd1389c89f988416f3bb20"
    },
    {
      "path": "PSP_GAME/USRDIR/movie",
      "type": "directory"
    },
    {
      "path": "PSP_GAME/USRDIR/movie/op.pmf",
      "type": "file",
      "size_bytes": 9015296,
      "sha256": "dea4dbf56a02aca27f4e078d9aa22dcb2e5d13017b1e31040727bc2e0a6b453b"
    },
    {
      "path": "PSP_GAME/USRDIR/voice.dar",
      "type": "file",
      "size_bytes": 392320,
      "sha256": "97869f07aaea014766b3af485f62b0e5f3b4af7a1b58542408e7c3be1db8dc4e"
    },
    {
      "path": "UMD_DATA.BIN",
      "type": "file",
      "size_bytes": 48,
      "sha256": "881a2a38cc46f14592bbef581bad3cb28b7feba5eb339eede316cae641055353"
    }
  ]
}
