{
  "kind": "tree",
  "schema_version": 1,
  "sha256": "6173dee1c7e08f2b0c1f08e53ce3ffb2c96857739f14636dc5634b09d3048bd6",
  "size_bytes": 6364400,
  "extractor": {
    "name": "pspdb-ingest",
    "version": "11",
    "options": []
  },
  "name_rule": "source_stem",
  "entries": [
    {
      "path": "module.elf",
      "type": "file",
      "size_bytes": 6364060,
      "sha256": "492e3e7213e93996f7b6c16f9e2b63aea396a8c8570857e2ccd64edef1419490"
    }
  ]
}
