{
  "kind": "tree",
  "schema_version": 1,
  "sha256": "b3f2775963fdcf2064793e2068b8c2423618bff17cfbfbd0d30ceb13a9c30152",
  "size_bytes": 21313536,
  "extractor": {
    "name": "Zig-PSP zPBPTool",
    "version": "4",
    "options": [
      "in-memory"
    ]
  },
  "entries": [
    {
      "path": "DATA.BIN",
      "type": "file",
      "size_bytes": 20998400,
      "sha256": "8b327bc40b7b0002f6f9290a982a038b2abac75c4ac1e3b1b72793646b9ef98a"
    },
    {
      "path": "DATA.PSP",
      "type": "file",
      "size_bytes": 8943,
      "sha256": "052bd0e6328f654ded84b0bdc464c09f770a7e853fd19153335359b7313bf96e"
    },
    {
      "path": "ICON0.PNG",
      "type": "file",
      "size_bytes": 11245,
      "sha256": "8e62137648616332a4eeb78496823d9c2aa0cfe5b7c4443f5cd76dbd68be2fd0"
    },
    {
      "path": "PARAM.SFO",
      "type": "file",
      "size_bytes": 592,
      "sha256": "ea515bdc3f1f65d4ee3dd371d1b1b8c884ed8fa8db4a662daaa6be7ec667d71c"
    },
    {
      "path": "PIC0.PNG",
      "type": "file",
      "size_bytes": 57834,
      "sha256": "dc1926c5a737637b0abc275b9c6c7ee60e2cec2d4e743524055bb25fb73a3eeb"
    },
    {
      "path": "PIC1.PNG",
      "type": "file",
      "size_bytes": 236482,
      "sha256": "59f53d019a8fa8c6b0b1f4981da1ca2d79e6ae7e91235b7170ef3878204ed3f7"
    },
    {
      "path": "STARTDAT",
      "type": "file",
      "size_bytes": 7503,
      "sha256": "d97b82a5ef5abf5de06ba27bf151212e370a37461736da77e287cd05900a09dc"
    }
  ]
}
