{
  "kind": "tree",
  "schema_version": 1,
  "sha256": "9931c0a265cde01cbf80170510bee7e66f5285fab161456c26a57c7fc4111c0d",
  "size_bytes": 149726,
  "extractor": {
    "name": "pspdb-ingest",
    "version": "3",
    "options": []
  },
  "name_rule": "decoded_suffix",
  "entries": [
    {
      "path": "payload.bin",
      "type": "file",
      "size_bytes": 237568,
      "sha256": "0aecd4501fd6054dbe7e7875f5dbed2e02ac5df22211637038a0eeeec5332868"
    }
  ]
}
