{
  "kind": "tree",
  "schema_version": 1,
  "sha256": "91deddc54f65bdf93e91fc74cf8fe0a36605ec3b3cd777450aa4bbf72e94555d",
  "size_bytes": 424208,
  "extractor": {
    "name": "pspdb-ingest",
    "version": "10",
    "options": []
  },
  "name_rule": "source_stem",
  "entries": [
    {
      "path": "payload.elf.gz",
      "type": "file",
      "size_bytes": 423858,
      "sha256": "75a98d9930b6068730c1263b1d765beaa462933c8723aa47e30b675db4e56b93"
    }
  ]
}
