{
  "kind": "tree",
  "schema_version": 1,
  "sha256": "a35bc3e3272477cbdd73f679a99c4312f5716de57f1b205d00c6ffc8efc18d92",
  "size_bytes": 1952,
  "extractor": {
    "name": "pspdb-ingest",
    "version": "11",
    "options": []
  },
  "name_rule": "source_stem",
  "entries": [
    {
      "path": "payload.elf.gz",
      "type": "file",
      "size_bytes": 1603,
      "sha256": "d494d0ed57d86732ab5fbfaeb46a225cca1890f83be7a3c35636d2b23b2da9fa"
    }
  ]
}
