{
  "kind": "tree",
  "schema_version": 1,
  "sha256": "1b25ad0de045c92c4b10ce08536a973994a3366366f744579d8a2984c298452a",
  "size_bytes": 5307472,
  "extractor": {
    "name": "pspdb-ingest",
    "version": "6",
    "options": []
  },
  "entries": [
    {
      "path": "ICON0.PNG",
      "type": "file",
      "size_bytes": 43302,
      "sha256": "5edfc2ae777addf53fcf1ae102718780b42f4b480a1ba4bb5d67ec85220e2f63"
    },
    {
      "path": "PARAM.SFO",
      "type": "file",
      "size_bytes": 504,
      "sha256": "2297ba1805d01644b12babd0dabb110dfb0d12601db7cf189f12779aaccd32fe"
    },
    {
      "path": "PIC0.PNG",
      "type": "file",
      "size_bytes": 232963,
      "sha256": "16cbcd50aab17deb2777c367eaba36345f08c31b6296f103585abe651e421a9c"
    },
    {
      "path": "PIC2.PNG",
      "type": "file",
      "size_bytes": 78227,
      "sha256": "7a693d6f5b19f279ad01848aacdbaba9dfdb4ea966628bb01a63167f1ad8a2f0"
    },
    {
      "path": "PS3LOGO.DAT",
      "type": "file",
      "size_bytes": 5120,
      "sha256": "e08430957ac3f4ee719dc2ed04d3443c395dd3b997d8f34f68a1b5c37d92f425"
    },
    {
      "path": "USRDIR",
      "type": "directory"
    },
    {
      "path": "USRDIR/CONTENT",
      "type": "directory"
    },
    {
      "path": "USRDIR/CONTENT/DOCUMENT.DAT",
      "type": "file",
      "size_bytes": 456288,
      "sha256": "617470e6222ca7afdc86b681687ac62f3b6e6d78c7636249e5b2c07271496fc0"
    },
    {
      "path": "USRDIR/CONTENT/EBOOT.PBP",
      "type": "file",
      "size_bytes": 4375056,
      "sha256": "2ff804be017ada65362d0f316e16e6e6f913ec33a7350736aea62e6b980d26de"
    },
    {
      "path": "USRDIR/ISO.BIN.EDAT",
      "type": "file",
      "size_bytes": 113280,
      "sha256": "810b4985f1b35c717f3d3154c178968eda461c12fe00b7114ee7bef7efb1986a"
    },
    {
      "path": "USRDIR/MINIS.EDAT",
      "type": "file",
      "size_bytes": 368,
      "sha256": "888d6a42ee8607402579f6e9c2622a32d9b085109b97dabc019c0df6c1c77604"
    }
  ]
}
