{
  "kind": "tree",
  "schema_version": 1,
  "sha256": "1a5018e6776c9fe0e229c279cbd8cb46df2329f547f2d85395d2df5487e11c7a",
  "size_bytes": 78614,
  "extractor": {
    "name": "pspdb-ingest",
    "version": "4",
    "options": []
  },
  "name_rule": "decoded_suffix",
  "entries": [
    {
      "path": "payload.bin",
      "type": "file",
      "size_bytes": 477136,
      "sha256": "b52c107ed4fa1590c02413d103dec030ba2f875ae56d15e9f5be095131da1655"
    }
  ]
}
