{
  "kind": "tree",
  "schema_version": 1,
  "sha256": "79db8cc00ae6d69da4667913749d22eeede540f8921ff83aebc2a61e5113b4a1",
  "size_bytes": 802,
  "extractor": {
    "name": "pspdb-ingest",
    "version": "3",
    "options": []
  },
  "name_rule": "decoded_suffix",
  "entries": [
    {
      "path": "payload.bin",
      "type": "file",
      "size_bytes": 2444,
      "sha256": "5c7da84d60939baecad865ea8f63c787b84fc54591b44d2a886122c50916c853"
    }
  ]
}
