{
  "kind": "tree",
  "schema_version": 1,
  "sha256": "67d8db322a48d8195cb16475c4d1d90bbea99731240220069fd47c45edbe4078",
  "size_bytes": 1856,
  "extractor": {
    "name": "pspdb-ingest",
    "version": "1",
    "options": []
  },
  "name_rule": "source_stem",
  "entries": [
    {
      "path": "payload.psp",
      "type": "file",
      "size_bytes": 1792,
      "sha256": "e9acb0d3653e9ba78ba28cb2c21946e3a5f5a67937a296c68aaee66ce96dbd12"
    }
  ]
}
