{
  "kind": "tree",
  "schema_version": 1,
  "sha256": "579425f77ed9c836ec6bb198bcf929dd03fc91513f57850889c4e4c51423384d",
  "size_bytes": 3180224,
  "extractor": {
    "name": "pspdb-ingest",
    "version": "11",
    "options": []
  },
  "name_rule": "source_stem",
  "entries": [
    {
      "path": "module.elf",
      "type": "file",
      "size_bytes": 3179888,
      "sha256": "fa8910c990de4076737e0eef2ef135ab7db214d27bdf7f9823ae2fe46f22c00e"
    }
  ]
}
