{
  "kind": "tree",
  "schema_version": 1,
  "sha256": "0aeff3c87769d9723fc511140b8dacfb4bd69ebf548b94600aeecc8ca49337fa",
  "size_bytes": 368,
  "extractor": {
    "name": "make-npdata",
    "sha256": "5889844a728bc2d495886cbb4fbc9129abddbb7aa9cbfd00dc2b1b927cdf6b91",
    "version": "1",
    "options": [
      "upstream:5f44642fa24331da79f4bae6bea516f1784cf1c5",
      "authenticated-edat:1"
    ]
  },
  "entries": [
    {
      "path": "plaintext.bin",
      "type": "file",
      "size_bytes": 80,
      "sha256": "ffbcb4d3f1fc45a9a984644ddca378016422eb7f9e8112db1118d5aacbaeb55c"
    }
  ]
}
