{
  "kind": "tree",
  "schema_version": 1,
  "sha256": "f3aea73c7a81d11caa93a440553f530d1dcd166c2bc2e11954f308288f0c0649",
  "size_bytes": 5546112,
  "extractor": {
    "name": "pspdb-ingest",
    "version": "10",
    "options": []
  },
  "name_rule": "source_stem",
  "entries": [
    {
      "path": "module.elf",
      "type": "file",
      "size_bytes": 5545768,
      "sha256": "45c10f7569130b389ea1ddaa6ec700d1e656c50e40056273e3671c6c8740ab9a"
    }
  ]
}
