{
  "kind": "tree",
  "schema_version": 1,
  "sha256": "080c83276b2d289a0c9508e9eed9829e093992fff5df798a6075970ecd78f7b4",
  "size_bytes": 212877,
  "extractor": {
    "name": "pspdb-ingest",
    "version": "3",
    "options": []
  },
  "name_rule": "decoded_suffix",
  "entries": [
    {
      "path": "payload.bin",
      "type": "file",
      "size_bytes": 467984,
      "sha256": "916594a9e4017ab7c73a0f4eea281a164774d53f46d00c399c376555128a839d"
    }
  ]
}
